{
  "schema": "asb.chapter/2",
  "datasetVersion": "2026.09.1",
  "rankingVersion": "asb.rank.v2",
  "translation": {
    "id": "bsb",
    "name": "Berean Standard Bible",
    "abbr": "BSB",
    "textVersion": "bsb-2023",
    "license": "Public domain (CC0), BSB Publishing 2023",
    "copyrightNotice": "The Holy Bible, Berean Standard Bible, BSB is produced in cooperation with Bible Hub, Discovery Bible, OpenBible.com, and the Berean Bible Translation Committee. This text of God's Word has been dedicated to the public domain."
  },
  "book": {
    "bookNo": 45,
    "osis": "Rom",
    "name": "Romans",
    "short": "Rom"
  },
  "chapter": 5,
  "chapterId": 45005000,
  "verseCount": 21,
  "prevChapter": 45004000,
  "nextChapter": 45006000,
  "headings": [],
  "tickerInline": 12,
  "verses": [
    {
      "vid": 45005001,
      "verse": 1,
      "ref": "Rom.5.1",
      "label": "Romans 5:1",
      "text": "Therefore, since we have been justified through faith, we have peace with God through our Lord Jesus Christ,",
      "omitted": false,
      "paragraphStart": true,
      "counts": {
        "out": 51,
        "in": 63,
        "inDirect": 41,
        "inViaRange": 22,
        "unique": 95,
        "shown": 12,
        "more": 83
      },
      "ticker": [
        {
          "rank": 1,
          "to": {
            "start": 43014027,
            "end": 43014027,
            "ref": "John.14.27",
            "label": "John 14:27"
          },
          "direction": "both",
          "votesOut": 5,
          "votesIn": 8,
          "score": 9.0,
          "weight": 1.0,
          "tier": "solid",
          "sameBook": false,
          "viaRange": null,
          "snippet": "Peace I leave with you; My peace I give to you. I do not give to you as the world gives. Do not let your…",
          "why": null,
          "aiStatus": "not_generated"
        },
        {
          "rank": 2,
          "to": {
            "start": 45015013,
            "end": 45015013,
            "ref": "Rom.15.13",
            "label": "Romans 15:13"
          },
          "direction": "out",
          "votesOut": 8,
          "votesIn": 0,
          "score": 8.0,
          "weight": 0.954,
          "tier": "solid",
          "sameBook": true,
          "viaRange": null,
          "snippet": "Now may the God of hope fill you with all joy and peace as you believe in Him, so that you may overflow with…",
          "why": null,
          "aiStatus": "not_generated"
        },
        {
          "rank": 3,
          "to": {
            "start": 45014017,
            "end": 45014017,
            "ref": "Rom.14.17",
            "label": "Romans 14:17"
          },
          "direction": "both",
          "votesOut": 6,
          "votesIn": 5,
          "score": 7.12,
          "weight": 0.91,
          "tier": "solid",
          "sameBook": true,
          "viaRange": {
            "start": 45005001,
            "end": 45005005,
            "label": "Romans 5:1–5",
            "span": 5
          },
          "snippet": "For the kingdom of God is not a matter of eating and drinking, but of righteousness, peace, and joy in the…",
          "why": null,
          "aiStatus": "not_generated"
        },
        {
          "rank": 4,
          "to": {
            "start": 23032017,
            "end": 23032017,
            "ref": "Isa.32.17",
            "label": "Isaiah 32:17"
          },
          "direction": "out",
          "votesOut": 7,
          "votesIn": 0,
          "score": 7.0,
          "weight": 0.903,
          "tier": "solid",
          "sameBook": false,
          "viaRange": null,
          "snippet": "The work of righteousness will be peace; the service of righteousness will be quiet confidence forever.",
          "why": null,
          "aiStatus": "not_generated"
        },
        {
          "rank": 5,
          "to": {
            "start": 45006023,
            "end": 45006023,
            "ref": "Rom.6.23",
            "label": "Romans 6:23"
          },
          "direction": "out",
          "votesOut": 7,
          "votesIn": 0,
          "score": 7.0,
          "weight": 0.903,
          "tier": "solid",
          "sameBook": true,
          "viaRange": null,
          "snippet": "For the wages of sin is death, but the gift of God is eternal life in Christ Jesus our Lord.",
          "why": null,
          "aiStatus": "not_generated"
        },
        {
          "rank": 6,
          "to": {
            "start": 44013038,
            "end": 44013039,
            "ref": "Acts.13.38-Acts.13.39",
            "label": "Acts 13:38–39"
          },
          "direction": "out",
          "votesOut": 6,
          "votesIn": 0,
          "score": 6.0,
          "weight": 0.845,
          "tier": "solid",
          "sameBook": false,
          "viaRange": null,
          "snippet": "Therefore let it be known to you, brothers, that through Jesus the forgiveness of sins is proclaimed to you.",
          "why": null,
          "aiStatus": "not_generated"
        },
        {
          "rank": 7,
          "to": {
            "start": 51003015,
            "end": 51003015,
            "ref": "Col.3.15",
            "label": "Colossians 3:15"
          },
          "direction": "both",
          "votesOut": 4,
          "votesIn": 4,
          "score": 6.0,
          "weight": 0.845,
          "tier": "solid",
          "sameBook": false,
          "viaRange": null,
          "snippet": "Let the peace of Christ rule in your hearts, for to this you were called as members of one body. And be…",
          "why": null,
          "aiStatus": "not_generated"
        },
        {
          "rank": 8,
          "to": {
            "start": 51001020,
            "end": 51001020,
            "ref": "Col.1.20",
            "label": "Colossians 1:20"
          },
          "direction": "both",
          "votesOut": 4,
          "votesIn": 3,
          "score": 5.5,
          "weight": 0.813,
          "tier": "solid",
          "sameBook": false,
          "viaRange": null,
          "snippet": "and through Him to reconcile to Himself all things, whether things on earth or things in heaven, by making…",
          "why": null,
          "aiStatus": "not_generated"
        },
        {
          "rank": 9,
          "to": {
            "start": 45005009,
            "end": 45005010,
            "ref": "Rom.5.9-Rom.5.10",
            "label": "Romans 5:9–10"
          },
          "direction": "both",
          "votesOut": 3,
          "votesIn": 4,
          "score": 5.0,
          "weight": 0.778,
          "tier": "solid",
          "sameBook": true,
          "viaRange": null,
          "snippet": "Therefore, since we have now been justified by His blood, how much more shall we be saved from wrath through…",
          "why": null,
          "aiStatus": "not_generated"
        },
        {
          "rank": 10,
          "to": {
            "start": 45008001,
            "end": 45008001,
            "ref": "Rom.8.1",
            "label": "Romans 8:1"
          },
          "direction": "in",
          "votesOut": 0,
          "votesIn": 10,
          "score": 5.0,
          "weight": 0.778,
          "tier": "solid",
          "sameBook": true,
          "viaRange": null,
          "snippet": "Therefore, there is now no condemnation for those who are in Christ Jesus.",
          "why": null,
          "aiStatus": "not_generated"
        },
        {
          "rank": 11,
          "to": {
            "start": 42007050,
            "end": 42007050,
            "ref": "Luke.7.50",
            "label": "Luke 7:50"
          },
          "direction": "in",
          "votesOut": 0,
          "votesIn": 13,
          "score": 4.6,
          "weight": 0.748,
          "tier": "solid",
          "sameBook": false,
          "viaRange": {
            "start": 45005001,
            "end": 45005002,
            "label": "Romans 5:1–2",
            "span": 2
          },
          "snippet": "And Jesus told the woman, “Your faith has saved you; go in peace.”",
          "why": null,
          "aiStatus": "not_generated"
        },
        {
          "rank": 12,
          "to": {
            "start": 23026003,
            "end": 23026003,
            "ref": "Isa.26.3",
            "label": "Isaiah 26:3"
          },
          "direction": "in",
          "votesOut": 0,
          "votesIn": 9,
          "score": 4.5,
          "weight": 0.74,
          "tier": "solid",
          "sameBook": false,
          "viaRange": null,
          "snippet": "You will keep in perfect peace the steadfast of mind, because he trusts in You.",
          "why": null,
          "aiStatus": "not_generated"
        }
      ],
      "connections": "connections/45005001.json",
      "ai": {
        "verse": "ai:verse:45005001:bsb:bsb-2023:v3",
        "status": "not_generated"
      }
    },
    {
      "vid": 45005002,
      "verse": 2,
      "ref": "Rom.5.2",
      "label": "Romans 5:2",
      "text": "through whom we have gained access by faith into this grace in which we stand. And we rejoice in the hope of the glory of God.",
      "omitted": false,
      "paragraphStart": false,
      "counts": {
        "out": 41,
        "in": 68,
        "inDirect": 30,
        "inViaRange": 38,
        "unique": 97,
        "shown": 12,
        "more": 85
      },
      "ticker": [
        {
          "rank": 1,
          "to": {
            "start": 49002018,
            "end": 49002018,
            "ref": "Eph.2.18",
            "label": "Ephesians 2:18"
          },
          "direction": "both",
          "votesOut": 8,
          "votesIn": 6,
          "score": 11.0,
          "weight": 1.0,
          "tier": "strong",
          "sameBook": false,
          "viaRange": null,
          "snippet": "For through Him we both have access to the Father by one Spirit.",
          "why": null,
          "aiStatus": "not_generated"
        },
        {
          "rank": 2,